,Tutorial Name,Tutorial Create
0,การใช้งาน JSON ร่วมกับ Python ครบจบในบทความเดียว,"Jan. 8, 2021"
1,ใช้งาน Django Login ด้วย Google OAuth API,"Jan. 7, 2021"
2,ใช้งาน Docker ร่วมกับ Django สำหรับผู้เริ่มต้น (Development Mode),"Jan. 4, 2021"
3,Flask Heroku Deploy - นำ Python เว็บขึ้นคลาวด์สำหรับมือใหม่,"Dec. 30, 2020"
4,Django App ดึงข้อมูลสภาพอากาศผ่าน Open Weather Map API,"Dec. 29, 2020"
5,python if name == main คืออะไร ?,"Dec. 26, 2020"
6,สร้าง Django with AJAX - ToDo App Ep.2,"Dec. 26, 2020"
7,Pandas DataFrame เชื่อมต่อข้อมูล,"Dec. 25, 2020"
8,สร้าง Python Line Chatbot ด้วย Messages ตอบกลับรูปแบบต่าง ๆ,"Dec. 17, 2020"
9,รวมบทความ Django และ Flask ใน Medium ของ STACKPYTHON,"Dec. 10, 2020"
10,ใช้งาน Django Sitemap -  สำหรับ SEO,"Dec. 8, 2020"
11,Web Scraping (Python) ด้วย beautifulsoup และ requests,"Dec. 4, 2020"
12,ใช้งาน python excel (พร้อมแบบฝึกหัด),"Dec. 1, 2020"
13,ใช้งาน Python OpenPyXL to read/write Excel,"Nov. 23, 2020"
14,Django Tips ที่ควรรู้ สำหรับสาวก Python Web Development,"Nov. 20, 2020"
15,"Python Pandas ช่วยงาน office อัตโนมัติ  csv, excel ผ่าน Jupyter Notebooks","Nov. 17, 2020"
16,ใช้งาน Flask ร่วมกับ SQLAlchemy เพื่อเชื่อมต่อฐานข้อมูลโดยใช้ ORM,"Nov. 12, 2020"
17,สร้าง Todo App Django REST Framework + Ajax Ep. 1,"Oct. 25, 2020"
18,Flask with Chart.js Tutorial - การประยุกต์ใช้งานร่วมกันระหว่าง Flask และ Chart.js,"Oct. 24, 2020"
19,เรียนรู้การใช้งาน Django Rest Framework with React.js [EP.3],"Sept. 29, 2020"
20,Django & Vue เรียนรู้และประยุกต์ใชัร่วมกับ database,"Sept. 26, 2020"
21,Building simple graphs with Matplotlib,"Sept. 24, 2020"
22,Basic Linux Command 1 เรียนรู้การใช้งานเบื้องต้น,"Sept. 21, 2020"
23,เรียนรู้การใช้งาน Django Rest Framework with React.js [EP.2],"Sept. 10, 2020"
24,เรียนรู้การใช้งาน Django Rest Framework with React.js [EP.1],"Sept. 8, 2020"
25,สร้าง REST API ด้วย Flask 101,"Aug. 30, 2020"
26,Django Debug Toolbar - เรียนรู้และประยุกต์ใช้งาน,"Aug. 27, 2020"
